id,name,description,detects
T1601.001,system patch im,defens ftp load debug method auth bound cisco cod t1542 show consol tftp 003 downgrad mem bridg hop persist dev protocol stor develop t1090 softw command us flash rommonkit runtim turn bootload junip myth access mit netscreen provid port t1205 chang keylog op fut http knock scp system download patch t1599 level network boot t1600 funct address run forens architect advers perimet start org t1601 vert proxy rootkit cop im manip t1556 comprom piec entir encrypt divers writ instruct revid conjunct launch t1056 attack reboot defend fil mod cap techn connect numb proc purpos exampl also output ex io,cent system download integrityass resourc network suspect debug vend contact run comput cisco integr fil platform html support trust oth mem inspect cap techn sec serv work cop dev http checks sourc adv comprom own com softw tool
T1558.002,silv ticket,cent system limit dump resourc kerberoast ticket forg adsec target us kdc t1003 abl attack password account grant advers 003 org mssql access host sharepoint scop tgs mit techn serv silv detect t1558 distribut http hash cred,field kerbero act logoff logon window id ev
T1213,inform reposit dat,system list min conflu databas resourc ia recipy network shar environ us target reposit inform link enterpr web attack object cod standard architect advers platform org infrastruct access inst valu project sharepoint mit docu techn dat serv proc cred work schedule phys snippet vary policy lev feat bas stor http develop exampl test collab sourc t1213 sql diagram tool aid,direct party conflu min pag resourc minim shar environ ev alert us report reposit inform domain admin enterpr logon analys artifact accesslogfilt microsoft account mean platform infrastruct behavy typ privileg access view mess valu sharepoint docu cap audit monit dat numb log apply mat detect lev bas ub stor exampl ex schema
T1070.009,persist,system reg act evid cyl plist method team9 group attack defend assocy artifact fil t1112 storm advers er org remov execut inst host mit mod techn malw pres serv dust ncc persist ord http t1647 jun cleanup,system reg command job assocy fil artifact remov process argu host valu key monit chang persist schedule window attempt
T1146,command hist,direct system sess hist export rm abus act cal command pass environ us search method histfil addit inform benefit keep cod fil everyth retrac point password account advers cleartext linux typ bashh track access histfiles hom intrud log lin way maco vary comprom flush,
T1555.004,man cred window,nam list expl rundll32 gui request network encrypt command keymgr auth us lock vaultcmd vault run man web attack cod fil t1555 edg vcrd credenum microsoft sign rest password advers 003 org appdat interfac button mit techn fold mech part backup recovery acquir cred lin apply text malwarebyt dev policy dll window http stor find vpol passcap krshowkeymgr usernam tool credenumerate internet ex brows websit ap,rsqb list listcr act cal bsol command us vaultcmd lock vault sol man cod fil credenum microsoft appdat process argu monit lsqb malwarebyt window usernam credenumerate cred loc ap
T1519,emond,direct system nam etc start sentinelon libr act emondc launchdaemon abus load command plist ev bin us auth xorry config jan writ run daemon launch attack var admin cod fil apr advers startup sbin t1160 org typ queuedirect path appl emond send magnusvir mit email privileg engin techn monit serv persist schedule plac com maco root http exampl tak trig form db rul,
T1194,serv,party company commun channel individ get environ med target kind goal job cont link webmail spearph enterpr comput fil build account advers industry someth troubleshoot send mess reason email payload engin interest employ restrict sec serv work way control attach bypass policy rapport opportun exampl scenario form softw,
T1200,addit hardw,system reply abus act frisk network pass t1557 weapon threat us med team hardw produc dma addit funct kernel traff star comput attack feb middl keystrok advers org alek ossman access oth mem mit nov payload gain techn cap mod august ref tap dev penet feat lev http vect stor inject sourc test march t1091,system wel thunderbolt databas commun network ev us driv hardw config addit address asset traff man comput metadat assocy mac cmdb endpoint dhcp access monit port usb help construct sens dev detect protocol sourc
T1505,compon softw serv,apply system funct volexity0daysophosfw access abus enterpr feat develop compon serv advers softw script,party system commun 314a ssl abus act cert encrypt network command pattern alert auth us ta15 flow run traff web assocy artifact fil tl behavy path process structure access execut mess argu dat monit connect compon correl anoma serv cmd ex log apply chang lin shel packet feat lev protocol syntax develop instal softw loc inspect attempt
T1485,destruct dat,direct dump threat post palo cloud t1003 t1078 cisco cod methodolog shamoon nov alto malw delet feat stor attempt resourc insid command environ us unit account structure access mit talo serv design doj op lev http disk stonedril t1561 system destruct network shar driv target smb cont admin point advers org infrastruct cas custom interrupt dam sect im window cred symantec t1021 rm goal impact attack fil machin behavy techn dat numb avail fireey shamoon3 worm kaspersky destroy,direct deletedbclust act destruct command ev bin us aw deleteglobalclust sysmon cloud deletebucket period cod fil eid volum machin tim infrastruct process argu inst mod audit monit dat delet serv gcp log chang sdelet im window stor snapshot quant ex system32
T1132.002,standard,system c2 request command spec inform cont traff wikiped advers mess base64 dat scheme text charact control bas protocol http ex body,behavy flow process cont commun packet dat cli monit network follow protocol port serv us
T1556.001,auth domain control,system patch resourc skeleton environ us auth domain enterpr attack reboot password account advers org process int access mem mit host s0007 key malw mech lsass work fact del control bypass http ex cred softw,system sess export act cal skeleton shar us auth busy funct inform domain hour run admin enterpr logon build machin account tim behavy own process access audit monit sec correl mech cryptdl serv openprocess login lsass log chang del control technet bypass dlls policy dll exampl ex vpn ap
T1537,cloud account transf dat,download incid channel network command environ indict transf cloud address traff defend fil account advers avoid jul interfac inst blend spac provid dat monit serv backup control detect exfilt bas watch ex,act network evid shar command transf addit cloud cont traff assocy fil account infrastruct process mod provid dat monit correl backup serv lin exfilt stor collect snapshot vpcs attempt
T1027.006,html,t1140 download abus byt outlflank us med mssaveblob plain hta funct inform cont web attack object cod fil attribut reach machin advers html org typ javascrib mit nobel payload docu techn hid dat sec deobfusc decod blob url victim html5 menlo text control construct bypass know past bas http stor inlin exampl disk drop filt,diff download act encrypt chain ev fil html challeng isol behavy javascrib view monit dat scheme part combin vary internet rul
T1556.005,encrypt,direct system radiuschapkey subauth howpwdrevenc1 abus radiuschap level byt powershel encrypt command nee howpwdrevenc2 mak us auth grain funct inform t1059 msradiuschapkey group domain attack cod assocy adus password account edit stat advers org structure dumppwddcsynt access valu mit property leg gain key lsa scop fgpp techn mod compon storepwdrev secret serv activedirect chang rassfm allowreversiblepasswordencrypt way plaintext dll policy window http stor output exampl userparamet set hash cred softw,direct t1484 act powershel encrypt command us grain config group comput attack cod default adus password account org dumppwddcsynt execut mit block property mod techn monit sec lin chang allowreversiblepasswordencrypt policy window http stor adaccountcontrol set
T1130,root cert,auth cod display sysintern sign adw block malw persist instal softw attempt clon commun libr bin us ca avoid trust inst spectorop usr serv ad antivir way control op maco cryptograph root http supply brows trustroot system superf keychain man assocy artifact wikiped advers valid spoof dec login ex reinstal comprom cred tool em ssl cert chain conjunct interceiv inform web object er tl manufact path execut mess techn cap connect sec apply bypass risk ord sourc set kaspersky websit,
T1022,dat,libr c2 channel encrypt command network util transf inform t1041 algorithm attack defend fil rar org custom mit zip techn hid dat le t1048 program control detect ord exfilt protocol http arch form inspect,
T1070.004,delet fil,system rm trac act t1105 network command us transf post footprint funct t1059 leav attack script fil july build cod microsoft advers org linux remov process interpret mit host techn ingr malw part intrud sdelet maco unlink window http exampl drop cleanup ex tool,system argu act fil command delet
T1189,driv comprom,reg for cli volex search post cod display endpoint interfac nov pay compon fac dmz bas com softw commun box us kind protect campaign plugin t1550 govern access mit gain provid design ad tok way control lev find http t1528 brows script system network shar ifram target driv oceanlot cross cont popup sit advers org insert javascrib host cas set vert interest shadowserv comprom visit exploit t1190 goal inform web attack object build scan industry dialog foc behavy process execut oau techn acquir apply plac wat exampl hol form websit cours,system visit list reg ssl resourc request network evid us heap transf writ domain traff attack cours analys script cod look fil endpoint tl org reput behavy process t1055 access execut send mit host inspect gain techn hid dat connect proxy id url discovery intrud spray recon detect obfusc bas inject http disk paramet websit comprom brows firewal tool attempt
T1498,network den serv,system defens t1499 resourc act ip trac increas conduc hackt network botnet difficul us method target address febru back traff attack web extort defend volum exhaust reflect endpoint capac advers effect octob org spoof send septemb block email dns host mit bandwid techn connect serv avail distract apply fireey ddo purpos aspect dev oppoisonedhandov bas http den exampl sourc filt internet symantec websit,commun network flow impact traff caus artifact volum met tim respons er process mess host provid dat monit heal serv highlight avail log apply sens respond detect exceiv ex
T1546.016,instal pack,system depend wel download resourc bundl command environ ev us upd post spec t1543 cont run trouton launch daemon attack fil build permit microsoft complet advers grant pack org linux prebuild privileg process execut end mit inst vert prerm techn brandon compon dalton serv apply persist msi preinst requir manip distribut http root window develop maintain lev appleje trig instal check script,apply cre process argu execut abus assocy monit fil command trig instal pack
T1595.001,scan block ip,wel databas resourc t1590 request network botnet reconnaiss detail us search target t1596 inform address ban domain t1593 attack artifact t1588 icmp scan advers respons org access block rang mit host vert techn cap t1587 serv victim ex t1133 ord form http opportun websit ping softw ip,flow process commun dat monit network
T1158,direct fil,system nam sof trod gui flag command investig bin us appleshowallfil util writ komplex wirelurk inform abl period cod fil show analys mac default ufhid ssh advers workspac linux start appl conceiv interfac view host key fold hid ye malw dir read lin chang persist mark charact apply attrib clut maco switch window find sery termin anywh stor exampl adv filenam set ex com ap,
T1221,inject templ,vba load auth taint anomal sept t1566 cod july microsoft xml ppt ind ooxml valu zip detect bas arch attempt field resourc t1080 byt forc pptx bin us spec blueprint pack access templ mit property phish proofpoint ref talo part url ryhanson control http script xlsx download abus macro shar smb t1187 cont docx advers org insert docu ex form comprom xl cred phishery doc word san oct off prompt attack fil payload techn togeth malwarebyt rtf inject exampl trig destin,act powershel network command pattern us off post child t1059 flow traff attack assocy fil follow org behavy structure process send execut argu host mit techn monit connect correl anoma lin apply construct packet http protocol syntax comprom ex inspect
T1037.004,script rc,system kit mov common abus v10 level map command iranthr us method systemd item cont run admin reboot attack result cod fil default mac panth permit fav advers startup launchd start org t1053 path privileg appl doco ubuntu custom mit vert dec techn rc malw mech serv compat intez persist shel manp maco root distribut kaij http hiddenwasp develop arch script,chang direct apply process behavy etc construct argu mod result monit fil rc command script lin
T1134,tok manip access,direct system field act level command runa t1134 us theft child funct run admin attack cod build permit account advers pentestlab start org process privileg access imperson mit techn sec mech someon ex cop tok control bypass know manip window http context own mak ap,cre system nam field expl pag eventhead trac act cal examin load network command thread impersonateloggedonus runa detail us ev util inform run man inconsist analys cod look analyst default endpoint microsoft account etw behavy logonus process access duplicatetokenex argu query set payload par audit monit dat sec correl ref id parentprocessid winchest ad lin log chang tok task control bypass manip window stor context processid adv tak usernam ppid ap
T1209,tim provid,system list reg resourc libr abus cli load network hkeylocalmachin hardw domain run stamp link admin man feb cod microsoft architect account advers tim startup start privileg execut valu timeprovid provid serv chang persist control synchron dlls dll window context output subkey paramet w32time currentcontrolset,
T1111,auth interceiv fact,crimin system nam commun em resourc replay level act network nee us auth target gen hardw method rollov interceiv algorithm cod password advers tim trend org capt insert access valu see email gain techn securid sec proxy input mech id serv rsa card passcod gcn keylog fact tok sm op mfa bypass dev adv jun mandy cred band,system reg resourc act cal instal network us driv target auth pol interceiv t1056 attack assocy keystrok advers org capt behavy insert access mit blend valu gain techn monit connect input mech serv card chang keylog fact window http form cred ap
T1159,launch ag,launchctl system direct list sof nam libr trod level load plist us demand method config komplex oceanlot launch daemon admin keydnap appledoc cod fil mac point advers launchd start appl dok structure process privileg execut property docu malw hom login log persist ag osx detect find develop paramet set softw,
T1027.002,softw pack,list wel defens decompress cal finf jan us method util protect leav run cod fil artifact mpress sign machin upx advers pack avoid mem techn eset chang know detect bas exampl form softw attempt,act techn us fil look artifact cod siz scan softw ind pack
T1584.007,,blackw command environ us target cloudfl funct cloud redirect traff attack attribut machin advers org infrastruct serverless mit techn provid proxy malw serv subdomain work lambd control op respond lev http comprom t1090,vis act command target effort funct assocy look advers org infrastruct behavy foc serverless dec stag lifecyc plac control detect lev threatconnect ex softw
T1071.001,web protocol,system field lay abus cli network command environ us traff web assocy advers avoid blend dat serv victim apply control packet detect protocol http filt head,ssl encrypt command pattern us flow domain traff web assocy fil follow tl structure process execut argu monit connect correl anoma lin know packet lev protocol syntax inspect
T1059.005,bas,party interop vba expl abus net macro framework command plan ev us driv off langu evolv cor hta funct vb cross t1059 cont model spearph attack web object t1106 t1566 default build microsoft wikiped advers tag platform html org support behavy javascrib execut vbs mit host vbscript leg docu techn payload block technolog compon program apply mark plac t1559 task webp attach bypass t1553 bas window http internet brows script ap,system patch abus act load command ev us off langu funct vb run admin assocy fil effect typ capt process int argu execut host vbscript mod monit apply dll bas window ex cyc script attempt
T1564.005,system fil,direct system qa reserv apf record act impl tabl boot us fil volum advers ext4 structure access nov fat spac bootkit hid dat mast sec mft compon pres input frag eset partit ntfs apply vfs fireey sect abstract way im stor malwaretech disk output comr also equ ex vbr loc tool,system reg act impl load us attack fil t1542 advers 003 org mit bootkit valu mod techn hid monit dat sec malw firmw key lifecyc chang aspect plac emphas window http set tool
T1543.002,systemd serv,direct system freedesktop pag 29sep2018 etc resourc level command boot us execstartpost config systemd funct background unit condit cov daemon man caus cod fil default execstartpr rapid7 upstart advers rhel org linux start sysvinit process execstart access execut ubuntu init systemctl privileg payload leg cento part usr serv victim execreload deb persist lib extend control janu root distribut stor march fedor 22june2016,cre system direct list etc command ev us util config systemd unit cont link man result cod fil sbin typ trust process execut systemctl argu baselin mod payload audit monit par id usr part serv hom lin persist lib construct root usernam script
T1563.002,,desktop system sess mov impl command environ nee us med team domain prompt admin attack consol permit account advers esc org tscon try privileg interfac rdp mit korznikov techn remot numb t1018 discovery serv someon rds log feat window protocol http ex cred system32 tool,cre sess commun act network command environ pattern us flow traff assocy fil follow behavy tscon process structure access argu rdp execut monit dat connect correl anoma serv cmd login lin fact packet protocol syntax ex inspect
T1136,account,system chant domain cloud access serv level detect us environ account victim advers tool ten,cre system act net command network userad ev us domain assocy account advers process argu audit monit dat id control window ex
T1547.013,entry,direct system desktop nam cre etc masquerad t1036 command environ boot us config funct link attack feb logon cod default fil advers entry startup linux typ org access argu mit payload key techn xdg program autostart lin apply persist extend exec http stor context tool,cre direct system etc command environ ev xdgconfighome boot config defend cod fil entry pack path trust process argu baselin mod audit monit xdg program autostart vary
T1584.004,serv,party act command us driv target post launch attack web t1189 advers 003 org support purchas mit techn stag serv task control op wat t1583 http also comprom hol,list vis ssl c2 act cert beacon command negoty pattern us target effort assocy artifact hunt scan advers respons tl org infrastruct behavy foc jul dec provid sep stag serv lifecyc plac control detect feat koczwar comprom threatconnect internet ex softw
T1526,cloud discovery serv,system etc github resourc ia exploit framework environ method ap cd funct cloud inform run group man pacu ci graph stormspot saa advers platform infrastruct support access gain provid id serv ad rel delivery lambd apply definit construct policy paa sourc integr softw tool attempt,system act network environ chain ev us target inform cloud look advers isol behavy view techn dat monit pres discovery part serv op bas
T1151,spac filenam,system cal click bin us launch filetyp fil default mac look edit advers renam someth typ process mach end spac handl backdo hid not program evil work chang text apply extend feat termin exampl filenam form txt trick ap,
T1018,system discovery,system s0039 list wel mov etc ip net cli cert network command environ detail us driv util hostnam target cdp funct t1059 address s0097 inform attack system32 cod fil show arp advers mean entry org infrastruct access view mit host ta18 techn dat s0099 pres discovery 106a ex neighb dev ord window http ident lev also ping cach softw tool attempt,system list mov etc success koadiac command network us hostnam address cod fil assocy scan process access argu aa host monit connect ex log eql dev detect ident tracert ping ip attempt
T1046,network discovery serv,system bradley list reg describ act exploit network environ broadcast us vuln method inform cloud run daemon cod ssh bonjo mdnsresponder scan advers sd appl infrastruct doco query host dns mdns port serv tcp acquir apply prem maco dev exampl softw tool attempt,system list commun act exploit network command environ chain ev us target flow cloud inform look advers isol behavy process view argu host techn dat monit pres discovery part serv op bas softw attempt
T1590.001,property domain,direct party nam who databas resourc act network environ reconnaiss detail us search target t1596 off busy contact inform domain address cloud dumpst attack t1566 endpoint scan advers org infrastruct t1598 access registr mit email property dns techn provid dat phish getuserrealm numb phon t1595 serv victim autodiscov t1584 acquir avail way vary reconna form t1583 http collect opportun comprom set ex t1593 websit ap,
T1518,softw discovery,system list t1068 act t1518 exploit environ us target inform cloud attack fig follow advers esc org behavy privileg inst mit reason vert techn sec discovery meas vary http shap comprom softw attempt,system nam list act cal softw cli command network environ ap cloud assocy show stat process argu inst vert monit dat ex policy set extract firewal rul attempt
T1538,dashboard cloud serv,cent resourc gui request command environ mak us config inform cloud asset address advers view query gain sec port serv gcp risk feat exampl dashboard cred googl ip ap,behavy system cloud inform man logon sec correl consol serv login
T1055.005,stor thread,system defens resourc network thread setup us method writ produc spec address attack cod point reach pe entry advers tl org process privileg t1055 access mem mit execut spac techn dat sec detect ord callback bas stor inject http context cleanup,defens cal thread us suspendthread resumethread funct virtualallocex cod july amount circumst tl typ behavy process privileg view sequ mem techn monit dat setthreadcontext chang writeprocessmem ord callback bas stor window inject createremotethread ap
T1622,debug evas,alkhas flood t1497 trac cal flag environ processhack jan debug search target virt cor hardw us produc breakpoint funct inform vxunderground ntqueryinformationprocess attack defend result t1106 artifact cod follow dridex sandbox peb opcod advers mean isdebuggerpres beingdebug tim org er behavy avoid process evas execut assembl mit block mess payload techn dat malw outputdebugstringw pres discovery victim checkpoint chang meas bas http loop exceiv shap github check ap,system mov act cal impl command environ chain ev debug ap inform step period cod sign advers tim isdebuggerpres mean isol behavy avoid process view argu dat monit id discovery part log op vary detect bas form check aid
T1036.006,spac filenam,system cal click bin us launch filetyp fil cod default mac look edit advers renam someth typ process mach end spac handl backdo hid not program evil work chang text apply extend feat termin exampl filenam form txt trick ap,perspect nam lin process extend end spac find fil monit termin command filenam not us ap
T1547.007,apply,direct nam list libr gui uuid plist wardl us method prompt attack cod fil mac logon tact ta0003 advers pref appl org path interfac chapt mit property payload malw loginwindow ad log apply persist maco checkbox byhost window http com,apply reg argu assocy fil monit command plist us log
T1608.006,seo poison,elect wel zscaler mov keyword mous us search driv seo target report langu fee crawl cont algorithm link sopho web attack defend influ result rank t1189 head sit scrutiny advers trend org reput purchas avoid poison mit lur host payload engin cap techn hid interest relev dfir gootload mech stag new t1608 victim habit boost input ad help text ag plant meas cloak stuff brows ord bas http form comprom set optim top scor loc trick,vis act exploit cli pattern driv target seo effort cont web attack t1189 scan advers org infrastruct support behavy foc execut poison mit techn stag t1608 phas lifecyc t1203 plac detect http comprom internet
T1550.002,pas hash,system mov act environ ticket us auth method pth ta0006 step attack t1550 password account tact advers cleartext org capt 003 access kerbero mit techn port control stealthbit bypass pas http hash cred overpass,cre sess act request touch ev ticket auth us ntlmv1 inform domain want logon assocy endpoint tgt grant advers ntlm process logontyp kerbero review dummy techn ntlmv2 monit sec exchang serv login perspect discrep way control pas window protocol comprom trig hash cred overpass attempt
T1052,med exfilt,system mp3 network play us driv med gap point circumst advers process dat hop phon usb air dev exfilt stor comprom attempt,process access argu dev let exfilt fil monit dat stor command mount point driv med attempt
T1574.002,load dll sid,system act flag load encrypt posit t1574 search us wait attack advers mean org pack trust process execut mem mit payload techn victim program mask sid apply delivery plant dlls dll ord http adv tak softw,cre system wel act load network ev us comput fil look attribut permit pe process access mod fold monit introduc program chang dlls dll
