id,name,description,detects
T1055.011,inject window mem,defens reg aug request load produc method cod july microsoft getwindowlong interfac mem valu malw writeprocessmem ewm detect bas stor loc ap resourc bit byt us pow protect privileg access inst soph port part program combin control system cal network shar target funct address setwindowlong point advers set spac handl prev appear sect return window context malwaretech chain writ attack dep class grant behavy process sampl execut payload dat sec input mech proc apply plac ord inject output trig createremotethread,funct sendnotifymess process setwindowlong cal ewm techn assocy monit window proc malw inject july microsoft trig getwindowlong ap
T1053.005,schedule task,mov reg method netapi32 cod sign valu s0111 delet persist t1218 serp bas softw panel rec describ libr command environ us metadat permit account sd startup trust access mit sigmahq proofpoint part program schtasks lin task way control http system index abus conduc util s0110 run admin man assocy artifact advers org t1053 query cas tarrask key hid proxy sect wrap window context tool gui attack defend t1564 tim process execut techn sec schedule scheduler also ex,cre system patch reg tasksched act softw for powershel command ev us r2 job cyc taskeng man instru microsoft twit svchost entry systemroot advers leoloobeek remov process argu valu vert key monit dat correl id delet serv lin chang schedule persist log task construct technet know window scheduler stor set ex system32 tool
T1205.002,socket filt,t1572 limit commun vis libr act winpcap cpu bpf setsockopt network command pass us pcapsetfilt target penquin conjunct funct traff attack soattachfilt crit permit advers platform org typ behavy interfac send inst libpcap host backdo mit exatrack socket techn monit dat connect opt lack persist control shel packet feat window protocol http ping match filt overhead trig instal craft tunnel,apply list process run enterpr policy socket monit connect filt accord
T1066,remov ind tool,system upd us target t1045 attack fil quarantin sign advers ind pack org remov mit vert techn malw vir http exampl softw tool,
T1560.001,util arch,direct party system download abus act diantz us util homep funct winzip attack cod fil advers linux pack org mit t1074 winr zip techn opt dat stag transport cabinet cop maco vary xcop tar makecab exfilt window http cab also exelolba loc,system act encrypt command network writ effort winzip assocy fil follow loss typ foc transit process argu winr zip dat monit prev intrud lin extend construct tar detect exfilt head compress aid
T1021.005,vnc,bug desktop system download t1021 resourc abus act libr impl mous exploit network command shar forc us auth vuln config inform t1078 attack comput keyboard fil display default machin account advers pentestlab platform org mem mit vnc docu techn monit dat sec input pivot serv login screen log framebuff rfb maco root http protocol relay havan cred softw check,system act network shar environ pattern us auth pred t1078 attack cod analys show screensharingd machin account org appl behavy process access mit vnc review techn monit connect eventmess login log screen fact maco http exampl attempt
T1047,man window instru,system msdn t1021 dcom mov abus command environ us inform model admin man attack object instru fil advers mean 003 org behavy wmi access execut mit payload techn port compon discovery part serv fireey feat window http lat winrm,behavy wmi process construct argu traff act monit connect network command environ suspect us lin
T1156,mod shel,direct sess list zshenv ev ssh cod bashrc tsunam interfac end malw persist vary bas termin ap attempt zsh command environ bin us rabbit gnu default exit permit startup linux rock profil tab leg hom bashlogin program ad lin op maco root lev kaij magento script system etc zshrc level trig target config funct run point zlogout advers insert zlogin login cannon alia zprofile bashprofil bash launch fil tim execut techn connect intez apply shel pearlshellbot ord exampl sourc bashlogout set,
T1113,capt screen,desktop cal xwd net us copyfromscreen util post funct inform screencapture cod mac advers capt access screenshot attempt malw screen op feat comprom cours tool ap,desktop system act xwd net legitim command network environ ev us method writ copyfromscreen ap inform screencapture cod fil mac capt behavy process argu giv monit dat malw correl screen im op sens detect output disk cours attempt
T1067,bootkit,system lay record mtrends act mbr load pass boot suspect us driv hardw bio cod volum lau advers are startup org process access execut init bootkit cas mast malw sect control vary disk remedy vbr loc,
T1037,init logon boot script,system boot us config funct inform admin logon account advers privileg send access init serv program log persist bas cred script,direct reg duty command boot us admin logon fil account tim process access argu init key monit chang persist window script
T1557,middl advers,system push sess defens commun ssl abus act encrypt network forc taxonomydowngradeatttl posit setup us cooky interceiv flow inform mitmtlsdowngradeat algorithm traff attack middl follow t1565 arp adblockerwithmin sit advers t1498 destin tl org support behavy ttint access downgrad mit dns dnschangertrojans vert techn tlseminardowngradeatt dat monit le malw serv victim aitm volexity0daysophosfw control t1040 dev manip feat http protocol llmnr lev exampl mitm ord also den t1562 cred attempt,cre wel nt act dword network chain ev us hardw address traff man daemon assocy dhcpservopevents metadat mac microsoft dhcp isol dnsclient behavy process view valu monit dat hklm anoma id part serv login aitm log apply chang construct dev policy window protocol llmnr sourc set softw
T1033,us system discovery own,direct system sess list dump act command grep environ detail us target util inform run t1003 attack dscl cod fil follow account advers org behavy process access mit techn numb whoam discovery acquir log way maco vary http exampl usernam shap t1033 own cred attempt,direct reg dump defens dcsync pid powersploit request pattern alert auth method traff t1078 sept analys cod microsoft systemroot drsr ind oth mem monit anoma know dev detect feat subsystem protocol stor stock softw system32 inspect attempt ip ap cre wel commun act map command us filesystem r2 t1059 domain default follow password account hostil linux structure avoid t1055 access argu mit serv program ship lin control http hash script gt system nam reply cal tabl network detail config funct flow man assocy advers org key dec sam correl not login lsass log cop sect packet window watch syntax comprom cred tool powershel getnccchang adsec samr lt inform attack fil build s0002 path process execut mod mimikatz techn dat connect sec lsa proc help text mat inject distribut ex
T1583,infrastruct acquir,party impl us target contact cloud domain launch traff web buy advers solv infrastruct purchas orchest host trendmicrohideoutsleas blend provid stag serv help op vary rent leas,system nam list who reg databas ssl resourc c2 cert beacon command negoty pattern us target effort inform domain run assocy buy artifact hunt scan advers respons tl infrastruct foc internet jul query track dns dec provid dat monit port sep stag serv lifecyc acquir help fac log control detect feat koczwar rent threatconnect leas ex softw aid
T1218.011,rundll32,confus defens t1036 load examplefunct micro cod analys obsc monit malw t1218 charact extend cpl com runhtmlapply attempt panel vic masquerad command us sct norundl dllname dllfunction avoid evas mit part lin chang control op http controlrundl script controlrundllasus nam export getobject abus shar examplefunction trig item funct man advers trend org support javascrib docu proxy on compat dll window syntax tool rundll32 click examplefunctionw writ www attack powelik fil behavy process execut t1129 payload mod techn sec numb exampl set ex github check shell32,rundll32 nam hist export act cal load command us med funct origin inform cont fil head permit sign process argu execut monit dat ow ag purpos dlls dll ex invoc
T1613,discovery resourc contain,pod mov resourc environ method config dock inform cloud leak step deploy web contain stat advers view query execut provid attempt discovery serv victim log apply im clust nod dashboard ap,apply infrastruct inform pod dashboard ap act web monit discovery contain account us kubernet log
T1583.007,,blackw command environ us target cloudfl funct cloud redirect back traff attack attribut machin advers org infrastruct purchas mit techn provid proxy malw serv acquir subdomain work lambd control op respond lev http t1090,vis act command target effort funct assocy look advers org infrastruct behavy foc serverless dec stag lifecyc plac control detect lev threatconnect ex softw
T1143,window hid,system list abus act awt powershel environ plist alert us langu config dock jav funct run admin attack cod fil mac show uiel advers tag org appl tray avoid cas mit vbscript property techn hid malw t1086 icon work apply carry task op windowstyl maco vary feat window http exampl jscript ex mak sight script,
T1161,addit lcloaddylib,depend field libr load command lccodesignature issu bin us rest sign advers tim mach execut malw dynam chang persist op dylib adjust maco osx sery check lcloaddylib head tel tool,
T1132.001,standard,system c2 command us spec inform cont asci traff standard wikiped advers base64 dat scheme gzip text charact control hexadecim unicod protocol ex compress,behavy flow process cont commun packet dat cli monit network follow protocol port serv us
T1027.009,payload,system lab defens commun abus byt network overlay pattern ticket bin med dtrack2 us report nest cont run impact micro attack psim analys fil default microsoft sign sentinellab advers trend 003 org support orchest trust sentinel process execut t1055 cas mit payload mod techn hid securel steganograph malw part not t1027 design carry control applescrib t1553 feat inject http exampl comr form brows github script weav,behavy inform nam cont construct med payload dat fil head amount siz sign posit ex highlight ind
T1150,mod plist,utf list sof libr trod plist detail us komplex whitel inform cod fil point permit xml advers pref path privileg oth execut argu property docu key mech serv program proc apply persist purpos bypass maco sery context form loc,
T1556.003,auth mod,system patch etc libr abus resourc shadow us auth config plain inform hat man pam cod fil password account advers appl access valu backdo mod guid compon exchang serv harvest pamunix text passwd stor supply cred,system sess etc vpn act shar us config busy inform hour admin pam logon fil build account machin auditd tim behavy path process own access mod monit sec correl serv login log chang exampl ex integr tool aid
T1578.004,cloud revert inst,act evid environ aw ap cloud man revert stop machin advers infrastruct remov typ tech republ inst techn provid dat pres vm chang vary detect bas stor snapshot dashboard attempt,system act ev plan us config addit cloud man tag typ support inst review mod provid monit rollback on vm proc log chang persist op deact stor ident snapshot head
T1148,histcontrol,system hist trac command environ us config leav cov keep cod fil default advers start linux bashh track spac histcontrol ex log maco respect also exampl set ignoredup ignorespac,
T1592,victim inform host,system nam visit databas resourc act reconnaiss chain detail us med target config langu search t1596 funct inform domain cont attack t1588 t1195 sit scan advers org t1598 access host mit techn cap dat t1594 supply t1595 t1587 serv victim design scanbox t1133 way vary form http collect regard opportun comprom websit set ex t1593 ip,visit vis occur act rat pattern us target effort inform cont defend assocy look scan advers org infrastruct foc access host dec stag lifecyc design scanbox plac detect threatconnect internet
T1596.003,cert,nam reg commun ssl resourc act cert encrypt reconnaiss issu threat auth us target search med inform origin cont traff sslshopper web attack artifact t1588 t1199 sign scan ca advers tl org trust t1598 access mit techn cap dat t1595 t1587 serv victim harvest t1133 lookup ord form http sourc opportun ex rel loc tool,
T1056.001,,system sess reg dump network blog us method driv effort hook hardw interceiv funct t1003 t1056 attack period cisco keystrok advers tim org typ capt foc process access mit custom t1601 buff mod techn leg dat input login acquir log way im dev callback http window opportun adv cred ap,reg act cal driv writ kernel inform fil getasynckeyst keystrok ind process valu key mod monit dat getkeyst chang keylog window disk adv instal setwindowshook ap
T1222.002,direct mod fil mac permit linux,direct list act impl command chmod bin us t1574 config taint flow group step t1546 ac attack icacls2 analys fil cod attribut permit advers platform linux org access chown oth mit execut mod techn chang persist control shel maco bas icacls1 hybrid nuant http jun set own tool,direct system list act rat command chmod ev alert util config ac icacls2 analys fil cod build attribut permit ind process access argu mod fold audit monit techn correl chang control maco icacls1 hybrid jun own knowledg tool attempt
T1110.001,guess password,list ftp ev auth addit cloud micro ssh sign samb interfac tcp sso dev bas protocol rout knowledg attempt forc environ cyl us lock default follow password account mssql access kerbero email opt port serv telnet op http system udp complex abus snmp network smb target mysql man advers trend org netbio ta18 id login guess policy window 068a cred cert wlanap off orac logon emotet fail ldap rdp vnc cleav connect le numb mech apply wif trig lockout,system network forc auth target t1078 attack result eid password account fail org access mit scop gain techn monit spray login ex log apply crack window http hash cred attempt
T1216.001,pubprn,direct vic limit abus command us cn upd sct t1059 domain monik print cscript attack printer1 mydomain cod fil follow microsoft sign dc sit account advers ldap solv valid 003 org behavy domain1 execut vbs mit host payload vert pubprn techn remot scriptlet fold proxy ref restrict serv container1 apply shel second bypass control bas http window protocol exampl paramet set ex com script,system patch act command us funct run cscript admin fil capt process int execut argu vbs pubprn monit proxy cyc script attempt
T1597.002,purchas dat,dark limit databas breach resourc act aggreg reconnaiss detail threat fee us target sel search contact inform domain t1078 web zdnet attack t1588 account scan advers org infrastruct purchas t1598 access mit cybercrim techn subscrib dat employ pay cap t1587 serv victim ex t1133 http sourc also opportun regard blackmarket form cred t1593 websit,
T1003,cred dump,sub system mov dump us inform attack assocy password account tact advers org ment access mit custom techn ta0008 sec login text mat http test hash cred softw tool attempt,direct reg dump defens dcsync pid powersploit request pattern alert auth method traff t1078 sept cod analys microsoft systemroot ind drsr oth mem monit anoma know dev detect subsystem feat protocol stor stock system32 softw inspect ap cre attempt ip wel commun act map command us filesystem r2 linkbyid t1059 domain default follow password account hostil linux structure avoid t1055 access argu mit serv program ship lin control http hash script gt system nam reply cal tabl network detail config funct flow man assocy advers org key dec sam correl not login lsass log cop sect packet window watch syntax comprom cred tool powershel getnccchang adsec samr lt inform attack fil build s0002 path process execut mod mimikatz lsa dat connect sec techn proc help text mat inject distribut ex
T1129,mod shar,direct system nam export libr cal load network shar unt us forward instruct spec funct ntdll x3c import attack t1106 cod fil wikiped advers entry org path mit payload mod techn manifest malw compon x3e part createprocess victim program ntfs apply extend way dlls pathnam dll feat window http loadlibr junct symlink loadfrom exampl filenam ex conv ap,direct system limit defens cal bundl load shar nee us funct cod amount circumst devy systemroot behavy path programfil payload mod monit dat routin know dll window softw ap
T1602,reposit config dat,system abus snmp cert us target config reposit admin man object ta17 advers access ta18 remot dat discovery 106a control 156a vary dev ord protocol stor quant softw,lay ssl encrypt network pattern config flow cont traff assocy follow tl access send host monit connect dat apply packet lev protocol inspect attempt
T1561.002,structure disk,system t1021 dump record resourc mbr network tabl load shar boot driv target smb palo inform unit cont impact t1003 t1078 admin comput attack cod fil account advers org isol structure shamoon process nov mit techn mast dat alto numb malw pres design partit avail fireey sect shamoon3 worm feat lev http window disk stonedril t1561 kaspersky cred symantec loc attempt,system record resourc act tabl network command boot driv target bio kernel mount point structure process argu block let mast dat monit numb avail partit chang sect dev superblock stor disk paramet instal loc attempt
T1498.001,network flood,system flood incid resourc cli conduc botnet network us target funct traff attack volum build amount circumst advers tim t1498 org infrastruct bank profil mit cas techn serv tcp avail ddo control packet http protocol rent den sery march internet attempt,commun network flow impact traff caus artifact volum met tim respons er process mess host provid dat monit heal serv highlight avail log apply sens respond detect exceiv ex
T1492,stor manip dat,system wel databas act goal off decid busy lazar inform desir campaign impact object fil affect rest expert advers typ insert process outcom access custom email mod hid dat doj sony vary ord stor form mak softw attempt,
T1574.007,interceiv path environ vary,direct system nam list libr cal powershel net load command environ bin search us method cod python entry advers systemroot path payload giv cmd program lin plac vary window stor exampl ex system32 loc script,direct cre nam system patch reg sess list act environ hkeylocalmachin findst us search admin man cod fil python advers path process mod key monit program upgrad control vary window instal currentcontrolset loc
T1213.002,sharepoint,system list min resourc network shar reposit funct inform link cod standard architect advers structure valu sharepoint project docu proc cred work schedule phys snippet policy lev develop sourc exampl test diagram,direct party min pag environ alert us report reposit inform domain admin enterpr logon artifact analys microsoft account mean platform typ behavy privileg access view mess valu sharepoint docu cap monit dat numb log apply mat detect lev bas ub sourc exampl ex schema
T1006,volum access,system wel act powershel powersploit util fil volum advers hakoby structure access techn monit dat program control bypass window ninjacop github tool,system powershel powersploit command driv t1059 protect attack fil volum org process argu mit handl techn monit dat log cop http ninjacop mak github script
T1044,system weak permit fil,direct system act level thread ev bin us networkserv target search t1038 report vend funct domain self run localserv attack result cod fil bootup permit account temp advers tim esc mean start org behavy t1088 process privileg access execut subdirect mit payload gain techn sec on part serv weak ex persist plac control dlls bypass vary dll manip window ord http context extract exampl adv tak set instal softw,
T1564.008,email rul hid,inboxr system mov commun hack abus c2 word powershel cli cmdlets alert us subject funct t1059 cloud cont admin spearph attack defend cod microsoft t1534 account advers respons org send mess mit email fold techn hid phish le sec malw inbox mailbox read lin mark maco detect feat window http bas body comprom set cred rul ap,cre system inboxr party act powershel cli cmdlets plist us config campaign cod artifact fil microsoft entry unsyncedr mess email mod monit inbox mailbox log apply syncedr maco rulesactivest window bec comprom set messager rul
T1491.002,defac,system hack defac act t1491 distrust intimid hackt setup ev threat us med target intellig propagand driv group attack t1189 spread govern sit stat advers industry respons trend org catalyst precurs mess mit sen techn quest govt commit victim ord http comprom trig integr div websit attempt,party system defac intimid command pattern us flow cont traff assocy artifact fil follow org structure process execut mess argu inspect monit connect correl anoma log apply chang lin packet protocol syntax websit attempt
T1171,nbt relay llmnr poison,system nam udp github resourc request network forc metasploit hash auth method us target smb conjunct nbt inform domain interceiv link step traff attack nbnspoof s0174 cod resolv microsoft password scan wikiped advers ntlm ide netbio org spoof path send access poison host dns mit t1110 cas ntlmv2 techn monit port compon id wir serv victim control technet t1040 respond crack plaintext llmnr window bas http relay sourc form cred softw tool attempt,
T1590.005,address ip,who databas resourc act reconnaiss detail siz us search target t1596 inform address domain dumpst attack scan advers org infrastruct t1598 access block rang host mit set techn provid dat dns t1595 serv victim t1584 acquir t1133 way vary form t1583 http collect opportun websit comprom internet ex t1593 loc ip,
T1499.001,exhaust flood,system flood limit arb annualdosreport resourc maxim request forc tabl jan search demand target cloudfl ack self confirm launch attack abl synflood caus nat corero exhaust endpoint capac amount stat advers send access connect numb tcp serv work syn way packet requir lev protocol den do handshak match ackflood ex,commun network command pattern us flow impact traff caus assocy fil artifact follow endpoint met effect respons tim er structure process execut argu mess host dat monit connect heal correl anoma serv highlight avail lin log apply sens packet respond detect protocol syntax exceiv ex inspect
T1014,rootkit,hyperv system record cal level network boot us driv hook blackh interceiv inform funct kernel attack fil t1542 mac wikiped advers org linux mit techn hid mast connect malw compon pres firmw serv rootkit program osx window http supply ex symantec ap,system mbr network us driv protect fil mount point wikiped typ behavy let mod monit dat connect compon pres firmw serv program rootkit vir chang dlls dev detect stor set ex softw tool
T1546.013,profil powershel,sess powershel flag load command environ is us driv funct t1059 domain cont run admin noprofil attack ps1 comput launch cod logon consol microsoft account advers tim start org support privileg profil mit host gain techn mod program persist op http exampl wit studio trig script,hostprogram powershel load command driv cont ps1 cod che microsoft process profil privileg pshome mod docu gain monit malw hom persist sheet stor archaeolog exampl trig loc
T1059.007,javascrib,cod microsoft platform html interfac mem bridg compon silv bas ap pag impl command environ langu hta t1059 mac runtim jscrip osascrib access mit engin sparrow autom part program lin t1559 control nodes maco applescrib lev http jscript internet brows script system download expl abus framework team util osakit driv cont t1189 specterop standard architect advers org support javascrib host os t1027 osx window comprom feb2021 inform model attack object fil jxa rest tim appl behavy execut payload techn cap osacompil apply text webp websit,system patch ta0009 act load command network ev us langu post ap funct inform run admin attack assocy fil cod jxa tact effect ind osascrib org capt typ behavy process int ta0007 execut argu host mit mod monit discovery lead lin dll detect window http collect sourc comprom jscript ex cyc script attempt
T1590.002,dns,party nam wel mx reg databas record resourc reconnaiss detail us search target off t1596 mail inform address cloud domain dumpst outlin attack saa scan advers org infrastruct access dns host mit techn provid dat suit t1595 serv victim t1584 subdomain acquir t1133 way spf vary form salesforc http t1583 opportun zendesk comprom set ex t1593 txt websit,
T1501,systemd serv,direct system rec freedesktop pag 29sep2018 etc resourc level pack command boot us execstartpost config systemd mail funct background unit condit cov daemon man 10jul2018 caus cod fil default execstartpr rapid7 upstart advers gist rhel org linux start sysvinit process execstart access execut ubuntu init systemctl privileg leg cento usr serv victim execreload acroread deb 8jul2018 bleepingcomput persist lib extend control janu root distribut stor march fedor arch comprom 22june2016 interv,
T1514,prompt execut,break authorizationexecutewithprivileg world abus cal masquerad dea rat t1036 request mak upd us coldroot origin prompt integr attack feb cod fil shlayer carbon machin black advers grant releas org behavy privileg mit techn mech victim program work apply persist purpos op osx maco lev root ord http develop sourc instal cred softw check trick ap,
T1123,capt audio,system record cal us writ inform comput fil advers capt audio malw video serv webcam apply purpos convers dev lev disk voic microphon script ap,record act cal command inform comput assocy capt argu audio monit video serv webcam apply purpos convers dev lev voic microphon ap
