id,name,description,detects
T1070.008,mailbox dat,system pag export act mailboxexportrequest cal powershel request evid command volex cobalt us util mail cybereason t1059 spearph attack man t1566 cod artifact t1534 advers 003 org remov mailx mit email mod techn exchangepowershel dat phish t1048 exchang solarwind kitty serv program mailbox log apply lin t1114 control applescrib bas http protocol collect exfilt exampl t1071 tool ap,system libr command mak us mail un var cod artifact fil quarantin appdat capt linux process argu host email spool monit dat delet log apply chang maco window stor usernam com
T1037.002,hook login,system libr logouthook command plist wardl us util hook t1543 loginhook admin launch daemon deprec attack logon fil cod default logout point permit fav loginwindowscrib advers tim pref appl org behavy insert privileg path chapt valu mit vert techn pair loginwindow not login ad lin persist ag maco dev root http com script,cre wel duty libr command plist us hook admin cod fil account pref appl process argu monit loginwindow login lin chang com
T1055,process inject,pip system nam defens commun resourc abus impl channel network produc method funct address cod advers platform ipc process privileg access execut mem sampl spac mod soph sec seg mech way detect ord bas inject context,cre system nam wel defens cal load ev us med suspendthread resumethread method funct inform cont inconsist virtualallocex cod fil july nat look permit sign amount circumst pe queueuserapc rhel auditd linux typ behavy ptrace process privileg view mem rang sequ mod stomp ntqueueapcthread monit dat ow techn chokepoint rootkit setthreadcontext chang writeprocessmem dlls know artofmemoryforens dll ord bas window inject ex head createremotethread ap
T1139,bash hist,hist abus command us bash util keep attack cod fil look password bashh typ flush da track program log lin way paramet usernam cred loc,
T1205,traff sign,list bleep mov flag blog auth method hardw traff cisco hartrel sign interfac valu malw persist charact dev feat bas softw firewal rout ip attempt ryuk commun wol libr observ command pass broadcast us pow nat turn amd sequ mit libpcap leg quest port serv program telnet t1205 syn task control respond lev mag http knock craft wak system patch conduc network target funct address comput architect advers respons org host custom t1601 socket hid lan im packet sery t1556 mandy goal off evolv clos attack object string mean cd00r send mod techn cap connect ord trig form,system list lay ssl byt encrypt network pattern gitlab mismatch wak target hardw ie flow address cont run traff enterpr cod assocy follow ff string wakeonl tl structure process send host payload socket monit connect port dat lan accord apply repetit packet dev policy lev mag protocol syntax anywh filt inspect attempt
T1503,web cred brows,system databas encrypt pass pattern passwordvalu chrome method target us search ap funct domain actionurl admin web object cod fil default logon edg july microsoft password cach account advers april cryptunprotectdat appdat mimikittenz process overlap query access mem cas privileg key veg gain dat attempt proofpoint talo victim proc read acquir cred login decrypt plaintext form window ord stor extract sql exampl firefox ste ex brows github googl usernamevalu websit destroy,
T1218,system proxy execut,system defens pag abus cert command bin us cont man cod fil default microsoft sign advers valid gtfo linux process trust execut split project techn proxy bypass bas window lolba instal,cre wel download reg defens hist msiexec act cal invoc load network command environ ev forg us bin cont admin web fil look sign pe advers typ behavy process trust send access execut host valu argu key gain mod monit connect proxy correl serv program intrud lin chang apply mat way construct dlls bypass msi dll window bas paramet internet ex cred ap
T1153,sourc,abus load command environ us upd funct run man cod fil build advers path argu spac techn not program way shel feat context sourc filenam,
T1038,search dll ord,direct system owasp nam level load shar bin search method us config admin attack web caus fil look microsoft fal advers esc behavy path privileg cas preload techn manifest victim program work persist plant plac way control dlls dll ord window junct adv redirect ex loc,
T1050,serv,system nam reg cal masquerad t1036 boot us util config funct background inform admin attack fil advers start org path privileg execut mit t1035 techn serv program apply technet window http stor softw,
T1070.006,timestomp,nam windowsir masquerad timestomp t1036 investig us attack analys fil attribut advers tim timestamp org mit techn fold hid malw chang http exampl tool,inform op valu handl mod fil timestamp
T1620,load cod,acbackdo rat load encrypt thread byol posit s1 00sec back keep attack cod fil artifact trick advers org path process t1055 execut mem custom mit payload techn snub malw ram donut intez mask detect ord inject http bas shellcod disk drop mandy ex tool,notepad trac abus rat load us execv langu clr 00sec funct mscor attack t1106 cod artifact runtim sign etw org process execut mscoree mem assembl ams mit techn monit memfdcr mech donut mdsec dll window http exampl dotnet drop ex createthread trick ap
T1611,host escap,break system sock t1068 direct resourc abus level channel exploit keyctl load command environ cron us vuln util config filesystem dock funct kernel run micro link admin man attack object july follow mount contain machin advers esc trend org privileg access host mit escap gain payload mod overview socket sep techn serv apply persist bind way control t1609 ord root http window exampl paramet drop opportun,pod act level environ ev us config kubernet kernel run syscal assocy volum mount contain process privileg host escap mod monit dat chang im clust root instal attempt
T1547.009,shortcut mod,system abus masquerad click t1036 chain boot us method target link launch attack indirect t1566 fil advers mean startup org path process mit lnk payload fold techn shortcut malw ref program login t1176 persist extend attach infect http exampl ex brows tool,cre system patch unknown network ev boot us target run launch analys fil edit advers remov path behavy process execut gre valu lnk mod monit connect shortcut correl program login chang know bas ident bsidesslc zon softw attempt
T1010,apply discovery window,apply system inform list keylog window context us prevail advers darkwatchm attempt,system getforegroundwindow list act cal powershel network command environ chain ev ap inform man cod instru advers isol behavy process view argu techn dat monit discovery part apply op window bas tool attempt
T1032,protocol,protect sampl control algorithm commun know traff impl engin key protocol fil encrypt command malw us advers config,
T1087.003,email account,direct list sess dump hil powershel globaladdressl get shar us auth address domain attack synt cod gal microsoft account advers workspac org try access outlook email getglobaladdressl gwsmo exchang serv prem cmdlet mailsnip googl attempt,addressl powershel globaladdressl command get us t1059 address inform man attack assocy instru enum cod account org process argu execut mit email techn monit window http t1047 offlineaddressbook
T1062,hyperv,hyperv system lay level environ us hardw t1014 funct guest run attack nat sit wikiped org typ myer mit xen techn hid interrupt rootkit http exampl ex softw,
T1497.003,tim evas bas,nitol ev method threshold t1106 analys timestamp valu malw vary bas needl loop ping softw attempt ap wel command environ us clock job day condit s0097 wait sandbox sleep avoid evas mit property repetit task op http meet uptim netskop trick system limit channel cal overload vme aw funct junk scrutiny advers org t1053 t1104 joe victim delay trickbot virt revil ham attack independ amount met machin tim sampl execut techn dat sec mech stag schedule ord also exampl trig ex nymaim,system mov act cal impl command environ chain ev method virt inform step period analys sandbox advers tim isol behavy avoid process evas view argu monit dat id part discovery aid op vary detect bas form ap
T1182,appcert dlls,system sess reg libr abus cal load appcertdl hkeylocalmachin createprocesswithtokenw funct run link man attack comput cod july createprocessasus winexec esc org process t1055 interfac privileg mit valu key techn createprocesswithloginw createprocess program apply persist control dlls dll inject http context currentcontrolset ap,
T1218.003,cmstp,list defens aug abus msitpro load command oct jan us sct inform scriptlets man attack squiblydoo cod fil july microsoft sign cmstp twit account advers auto org profil access execut interfac mit regsvr32 techn connect proxy serv program ex applock lin inf apply t1218 control dlls bypass lev http t1548 also paramet supply instal com,cre cmstplua hist 4cd9 abus act a845 80c07c3b881f strategy load network command ev us target 3e000d72 sysmon inform cmluautil fil july 9a51 a120244fbec7 cmstp advers auto parentim process send argu execut host interfac payload monit connect victim 3e5fc7f9 proc bd83 im construct com detect ex invoc rul
T1563.001,ssh,system clockwork sess mov t1021 breach t1563 abus cert encrypt environ slidesh us auth blackh post t1078 attack ssh password account advers org trust access host mit sshjack key socket techn connect pair ag shel ord root http adv tak comprom ex rel tunnel,system sess mov commun command network environ pattern us flow traff period ssh assocy fil follow account tim structure process access execut argu socket monit connect dat correl anoma lin log ag packet protocol syntax inspect
T1562.002,log window ev,cre system nam sub limit success auditpol record act msc powershel command evid ev us pow target config 002redcanaryco advancedsecauditpolicyset run prompt cod logon default analyst follow stop account fail advers turn t1562 remov process audit dat secpol sec le compon serv login log apply chang lin eventlog detect lev window eventlogcoretechnolog policy auditpolicymicrosoft categ exampl paramet adv comprom set ex allus tool attempt,system party limit patch auditpol reg act s0645 command ev sc us hkeylocalmachin addit funct run cyc admin attack script fil artifact stop s0002 org capt process int view argu mess mit evtlogtamp mimikatz audit monit dat wevtutil phant0m serv log apply control eventlog detect lev window http minint exampl defevwineventlog softw currentcontrolset tool attempt
T1029,schedule transf,channel act c2 network pattern us transf day inform t1041 traff attack advers tim org mit blend techn dat t1048 avail schedule exfilt http protocol interv,address wel send traff man dev host metadat monit mac protocol network sourc connect us hardw dhcp
T1021.002,admin smb shar window,system sess patch mov act impl level cal network shar bin us smb transf config job conjunct funct rpc domain run print t1078 admin attack abl man fil instru t1550 microsoft account machin samb advers wikiped ntlm org t1053 access execut mess mit block techn hid remot t1569 port serv proc log schedule cop task technet pas window http protocol rpcs t1047 exampl hash,system s0039 success commun mov act net network command shar ev us smb forward transf t1078 attack logon fil eid assocy account fail advers payn org typ behavy wmi process send execut mess block mit host argu interfac techn remot monit dat connect port correl discovery serv login log lin persist window http interact ex softw tool
T1525,im,list lab reg environ aw instruct cloud web amazon attack sept cod runtim contain permit machin t1505 advers platform 003 org foc infrastruct access septemb inst mit backdo gain techn provid malw serv t1608 victim gcp persist am rhino plant im shel http upload develop comprom googl tool,addit im reg daemon set mod audit monit interact environ contain machin us config dock log
T1572,tunnel protocol,system t1572 commun lay abus c2 t1090 encrypt network smb conjunct traff t1001 attack ssh godlu resolv bleepingcomp advers mean 003 org infrastruct behavy avoid access query rdp mit blend imperson techn dat port proxy victim jul19 apply packet detect lev protocol http doh exampl t1568 filt internet destin vpn rout tunnel,commun network command pattern us flow traff assocy fil follow structure process send execut argu host dat monit connect correl anoma lin packet protocol syntax inspect
T1218.002,control panel,list reg export abus libr cal click menu load command hkcu jan bin us util ap spec item funct palo dllentrypoint campaign link comput attack cpl t1566 cod fil cpls microsoft cplapplet advers org process view execut eas interfac mit nov payload handl dec techn alto phish currentvert proxy malw part stag program lin apply extend control trendmicro bypass dlls dll window http jun reav set ex softw panel,direct reg ev method cooky propertysheethandl cod cpls microsoft guid fold monit malw hkeyclassesroot t1218 extend trendmicro detect stor lat cpl system32 softw panel ap act command hkeylocalmachin us entry hkeycurrentus inv access mit property gain engin serv swnormal lin control http disk controlrundl internet controlrundllasus system nam expl cal shellex forg funct item cont clsid assocy pe canonicalnam org key im dll form window ident controlpanel tool namespac rundll32 click jan inform launch web attack fil winexec path execut currentvert techn apply shel bypass filt ex shell32
T1599.001,network address transl travers,system limit patch transl act network pass environ us config funct bound address cross traff rfc1918 transmit attack defend nat advers challeng org trust process send access cas mit t1601 custom mod gain restrict monit bridg dat techn mech design chang control im bypass packet dev lev bord http sourc exampl internet destin head firewal rout ip,commun network command pattern us flow traff assocy fil follow structure process execut argu dat monit connect correl anoma lin packet protocol syntax inspect
T1608.002,upload tool,party download github skim s0029 t1105 network tg us target transf off attack web commerc machin sit advers platform org infrastruct support purchas avoid repo mit hol host techn provid ingr phish malw serv victim intez t1584 acquir apply purpos plac control op del wat psexec t1583 http upload rent sourc comprom internet ex softw loc tool ap,vis act t1105 pattern target effort transf post attack scan advers org infrastruct behavy foc mit techn ingr stag phas lifecyc plac detect http comprom internet tool
T1547.005,support sec provid,system reg osconfig abus cal ssps load encrypt boot auth us addsecuritypack config ssp funct domain cod password advers tim start support pack process access key provid lsa graeb sec hklm card log control dlls pin plaintext window stor currentcontrolset ap,system reg nt abus ssps load command boot ev config r2 ssp cod fil microsoft auditlevel support process argu execut key currentvert provid monit lsa sec hklm opt graeb serv chang im dlls dll window set ex softw
T1004,winlogon dll help,system expl reg nt abus act at load hkcu cyl ev us sa funct wow6432node sept logoff ctrl logon cod caus follow point microsoft userinit entry winlogon advers pack support execut sequ init currentvert mod hklm compon not program help log persist shel dlls feat window subkey adv trig ex softw,
T1009,pad,limit virustot maxim increas siz bin us config pad oceanlot funct blackl trick fil analys junk affect sign scan advers april effect faq behavy avoid repres end lik handl cap dat sec malw serv design ad vir eset chang sect detect bas upload disk checks decreas hash tool,
T1550,auth mat,cre system mov environ ticket auth us gen ta0006 nist attack password tact advers org process access kerbero mem mit techn id card cred apply mat tok fact control bypass pin mfa know risk plaintext ord http altern disk usernam hash cach,party system sess mov resourc act request network environ shar ticket auth us busy domain hour admin web artifact eid password account machin grant tim behavy own process access kerbero mess gain monit serv login ex log apply mat tok control bypass ord window altern exampl hash cred attempt
T1076,desktop protocol,desktop system sess party t1021 impl command nee us med conjunct t1015 domain prompt admin attack cod consol permit account advers esc org tscon try privileg interfac access rdp mit korznikov techn remot quest malw numb alperovitch discovery t1018 serv acquir rds log someon persist redsnarf feat window protocol http ex cred system32 tool,
T1597.001,vend intel threat,nam wel breach resourc act conduc concern reconnaiss detail threat intellig fee vend target us off search report t1190 cti inform d3secutrity domain campaign attack ttps object t1588 attribut advers industry trend countermeas ind claim org access custom mit cap techn dat pay port t1587 serv ex t1133 fac apply http ident regard opportun form t1593 websit,
T1011,med network exfilt,radio channel network command med enterpr rf advers access proxim dat connect bluetoo wir frequ control wif exfilt exampl modem internet rout attempt,commun channel network command pattern us med flow traff assocy fil follow structure process access execut argu dat monit connect correl anoma read lin control packet exfilt protocol syntax inspect attempt
T1602.002,network config dev dump,export snmp cert load network reset blog us target config reposit inform man attack cisco analys fil layout account advers infrastruct access query mem ta18 leg dat 106a smi cop op dev protocol stor lat paramet cred softw tool,lay ssl encrypt network pattern config flow cont traff assocy follow tl send access host dat connect monit apply construct packet lev protocol inspect attempt
T1589,victim inform id,system nam reg github resourc gitrob reconnaiss detail us auth target med search elicit deloit inform address domain trufflehog leak t1078 attack t1566 account scan advers mean respons org t1586 t1598 access mit email techn employ dat prob t1594 phish id cnet t1595 serv victim tok way vary ub form http opportun usernam opm comprom set ex cred t1593 websit,field act request network botnet auth us inform traff web metadat artifact advers string prob ref ag http sourc quant
T1131,auth pack,system msdn reg load bin us auth target logon cod advers start support pack process valu lsa sec hklm ref mech autostart persist plac control dlls window protocol currentcontrolset loc,
T1181,inject window mem,system reg privileg aug cal bit byt request load shar chain us trig writ target pow funct address protect setwindowlong attack cod july point microsoft dep class getwindowlong grant org behavy process t1055 interfac execut mem inst valu spac handl mit techn access dat payload soph malw input mech part prev port proc program combin appear apply writeprocessmem plac sect control return ewm bas window stor inject http output malwaretech set createremotethread loc sampl ap,
T1562.004,system firewal,system limit reg commun mov c2 network command us edit advers key dat mech lin chang way control bypass ord window exfilt firewal rul panel,system reg commun network command shar hkeylocalmachin ev us driv domain group print currentcontrolset assocy cod fil ufw stop stat advers sharedaccess smd profil argu rdp valu mod key audit monit port ye sec netsh serv log chang might window protocol firewallpolicy advfirewal paramet set firewal rul
T1560,arch dat,party libr encrypt network us method util inform defend amount advers custom hid dat le detect exfilt compress inspect,system patch act encrypt command network writ effort funct run admin winzip assocy fil follow loss capt typ foc process int transit argu winr zip dat monit prev aid intrud lin extend construct tar detect exfilt head cyc compress script attempt
T1152,launchctl,launchctl sof trod thing abus load command ev labelnam komplex simpl funct whitel launch daemon cod advers support path process privileg handl input program lin chang persist ag control bypass tak arg mak reload,
T1553.003,trust provid,reg maj search subject wow6432node sept funcnam cod july microsoft sign interfac valu guid compon authenticod abstract requir match instal softw mismatch ap libr impl us origin eduardosblog malicy catalog april pack typ avoid trust mit spectorop provid hklm program sipguid control t1553 cryptograph http disk hash integr craft system export finalpolicy complex abus cal conduc driv decid funct link point architect advers valid org encodingtyp handl catch oid not ex cryptsipdllverifyindirectdat inquiry return policy dll window ident drop tool lay powershel cert poc t1574 attack fil cryptsipdllgetsigneddatamsg process execut mod techn sec saf apply bypass winverifytrust ord paramet form github check,sub system list reg aug od craft dat load ev us inform malicy spectorop v2 cryptoap wow6432node attack sept object cod fil july default microsoft sign autorun advers entry er valid monit org ind hid auto trust process access execut start valu regedit regsvr32 mit mod key audit provid techn sec hklm sac oid part cap not capi2 id compon log t1218 control policy cryptograph window http disk adv ex integr softw loc attempt
T1483,gen domain algorithm,umbrell list nam wel dga channel word act net command us gen instruct cybereason contact domain address unit algorithm cont traff attack cisco defend feb istgmxdejdnxuyl period stat advers string tim mean april org track oth block see valu let mitig mit techn malw fallback gib serv ex purpos control construct form bas http ru t1008 adv destin mak check ip,
T1185,brows sess,sess ssl resourc cli cert right cobalt us vuln auth cooky chrome sedebugprivileg funct interceiv inform cont admin man integr traff web clos cod attack webmail permit wikiped advers org behavy process cobaltstrik tab mit sharepoint intranet techn connect sec proxy part pivot strike chang fact way icebrg extend bas http context t1213 exampl adv tak set brows softw,act auth us traff attack web advers org behavy process t1055 mit techn audit monit login mask log apply inject http match brows
T1021,serv,desktop sess t1021 mov mdm abus act ard prompt network command environ workst us t1072 transf domain t1078 enterpr attack man deploy kickstart ssh fil admin cod tcc account machin advers org appl lockboxx access execut rdp mit host vnc blend buff techn remot guid connect gain vert id dat serv program design login telnet log apply screen fireey shel control transp maco lev http protocol cons exampl interact set cred softw tool,cre system wel mov abus act ard load network command shar environ ev pattern us smb auth transf flow t1078 man attack period ssh fil analys account screensharingd pe advers tim org lockboxx behavy appl process access argu rdp mit mess vnc block review techn monit connect port dat correl discovery serv tcp design login telnet log screen dlls maco dll http protocol interact exampl rel attempt
T1071.003,mail protocol,system field lay abus cli network command environ us produc mail imap traff assocy advers avoid mess blend email dat pop3 serv victim apply delivery control smtp packet detect protocol filt head,ssl encrypt command pattern us flow traff assocy fil follow tl structure process execut argu monit connect correl anoma lin packet lev protocol syntax inspect
T1556.007,hybrid id,direct tie patch azureadconnectauthenticationagentserv wel record reg resourc fed load shar environ us auth forward team config cloud run hand admin web fil consol microsoft password account saa edit advers servicehost platform org claim ten process privileg access trust cas backdo opt numb id mech pta fact serv harvest ad magicweb ag plac way prem tok bypass synchron ph dev pas dll ord bas policy hybrid aadintern exampl comprom identityserv set hash cred rel attempt,cre record cert load environ ev alert us auth vuln config cloud assocy fil attribut microsoft sign servicehost solv in claim process access valu backdo review mod audit monit connect sec proxy id pta serv ad magicweb apply log mat ag discrep lack dlls hybrid exampl identityserv eku azureadconnectauthenticationagentserv
T1595.002,scan vuln,databas resourc network reconnaiss t1592 us vuln target config search t1596 t1190 spec inform domain ban run t1593 attack artifact t1588 scan advers org access host mit vert techn cap port numb t1587 serv victim apply fac form http opportun ex softw websit attempt,commun command network pattern us flow traff assocy fil follow structure process execut argu monit connect dat correl anoma lin packet protocol syntax inspect
T1596,databas,who databas reg ssl resourc cert network reconnaiss us search target reposit med inform domain traff sslshopper attack artifact t1199 scan advers org infrastruct trust t1598 access dns shod mit techn dat serv victim t1584 ex acquir digitalshadow cdn t1133 rel lookup t1583 http collect sourc opportun comprom dumpst form t1593 websit,
T1207,rog domain control,direct system reply list reg hist act ev blog us method adsec config produc report t1134 inform domain admin man attack object assocy metadat analys dc dcshadow account advers org infrastruct behavy siem privileg access rog mit key mimikatz guid dat techn sec monit serv ad partit krbtgt chang ntdsdsa log sid persist control bypass sens manip inject http hash cred schema,direct cre nam reply cal dirsynt network drsaddentry detail alert us ev blog cooky gc config drsreplicaadd princip unit ou traff e3514235 comput feb object assocy microsoft addsec dcshadow dc stat advers password spns drs 00c04fc2dcd2 process interfac kerbero host rog baselin spn guid audit monit dat 11d1 minut serv ad ex log chang partit ntdsdsa plac 4b06 synchron lev protocol getncchang trig dcsyncmonitor github ab04 schema
